{
  "changes": [
    {
      "after": "982d80fb40471b1c0d94bab66d67ac707181d8b5d755306c95e8910b2f397182",
      "before": "9aff052fcb8c0b99b168e8dda61c64daff722912fdd58fe3ed534db8e25fa80b",
      "path": "lifecycle.completed_stages"
    },
    {
      "after": "44b00fb30aab06b39fff2678189186a24b7fe8b9c2b1beba2878e1e79c142980",
      "before": "9ce49cff44ff8d4c92e1928f1cf7d389b33d154a54a431fa73f74c34859654e3",
      "path": "lifecycle.current_stage"
    },
    {
      "after": "d5c6101f7c16736502357f4222db4392bdea392895dcbfe5422a74d196a0fb2e",
      "before": "da6dada3780bd3f621562baa5280ba0edb41fb2f71f51d2c4af5909ada4d5a4e",
      "path": "lifecycle.next_permitted_stages"
    },
    {
      "after": "e7f6c011776e8db7cd330b54174fd76f7d0216b612387a5ffcfb81e6f0919683",
      "before": "ef2d127de37b942baad06145e54b0c619a1f22327b2ebbcfbec78f5564afe39d",
      "path": "revision"
    },
    {
      "after": "3de886560fd9e695f0bd0587e927c4a807e0f2401afc69efffd2326f01050d12",
      "before": "4f53cda18c2baa0c0354bb5f9a3ecbe5ed12ab4d8e11ba873c2f11161202b945",
      "path": "stages.specification-approval.evidence"
    },
    {
      "after": "eeee87d13d482e597f01322360c761fcaab8035e9cfb24e25a289650a74da5b4",
      "before": null,
      "path": "stages.specification-approval.recorded_at"
    },
    {
      "after": "fedce8e8af485c2586f54c43a9b656dc70b41eb9be8c64b69c98391847dd4baf",
      "before": "8dbb15f3394e378ebd84bdd4ad4a91f3bce2dae0d1708f79db0b5ef6da11a343",
      "path": "stages.specification-approval.status"
    },
    {
      "after": "eeee87d13d482e597f01322360c761fcaab8035e9cfb24e25a289650a74da5b4",
      "before": "97dedbb9ef282744f805940b1d744364ffdbfbed134d2d72a02b069e8a7350a7",
      "path": "updated_at"
    }
  ],
  "event_type": "lifecycle.transitioned",
  "manifest_sha256": "93533fdeb00d319423dfedbc76f713feafdc0745fa1c76e54363cbdc1999b05b",
  "previous_event_sha256": "189c13884892cdf131320d6ca422732963623cf7df76c48f7f568b089444dd93",
  "recorded_at": "2026-09-26T19:58:44Z",
  "run_id": "20260926T195818286566Z-9b54edda",
  "schema_version": "1.0",
  "sequence": 6
}
