{
  "changes": [
    {
      "after": "1039a0718a3f23a23f45dd9c813cc808c924552cd36c9fee3c4a5d920a18ffe9",
      "before": "4f53cda18c2baa0c0354bb5f9a3ecbe5ed12ab4d8e11ba873c2f11161202b945",
      "path": "human_decisions"
    },
    {
      "after": "4b227777d4dd1fc61c6f884f48641d02b4d121d3fd328cb08b5531fcacdabf8a",
      "before": "4e07408562bedb8b60ce05c1decfe3ad16b72230967de01f640b7e4729b49fce",
      "path": "revision"
    },
    {
      "after": "07d13a3acfdb6c7c6f6eaa4c249e303186e87f07d5a98501c287476d572ef0f9",
      "before": "043a4248f17a4c20b1bc7b46e520686e8a63f77dad6eb8606c3bd79448d51ba3",
      "path": "updated_at"
    }
  ],
  "event_type": "human-decision.recorded",
  "manifest_sha256": "dc8f412e41b59e025f40a053e441d33407d5f6fc3ff1da2b5e3de383b1afdce2",
  "previous_event_sha256": "609faf7980f5b48ddf00faaec016379efedc5e314f35a6fa72d511dac064e20e",
  "recorded_at": "2026-09-26T19:58:37Z",
  "run_id": "20260926T195818286566Z-9b54edda",
  "schema_version": "1.0",
  "sequence": 4
}
