{
  "changes": [
    {
      "after": "d4a2f80e70d9db26b22e55edf0e81bc054b92a39fcf91d9889aca3bec12e4819",
      "before": null,
      "path": "adlc"
    },
    {
      "after": "a65fc2f62a6a15e6f86cc54808c76118d5ffebda0c02b8894f9d7a891e8e05d4",
      "before": null,
      "path": "artifacts"
    },
    {
      "after": "4668901051eb105088e86fd1e0f652959e68cb4a68a5daca7e2799717aef9cca",
      "before": null,
      "path": "context"
    },
    {
      "after": "74234e98afe7498fb5daf1f36ac2d78acc339464f950703b8c019892f982b90b",
      "before": null,
      "path": "ended_at"
    },
    {
      "after": "4f53cda18c2baa0c0354bb5f9a3ecbe5ed12ab4d8e11ba873c2f11161202b945",
      "before": null,
      "path": "failures_and_interventions"
    },
    {
      "after": "73abba6f24e6513eff77572312ee3252edbf079bfc977a9ab204f4881408901a",
      "before": null,
      "path": "git"
    },
    {
      "after": "a4a5b5f9a360f68edeaf157e0ea683fe15d216c198c43a2527b91fa29e0c4f39",
      "before": null,
      "path": "governance"
    },
    {
      "after": "4f53cda18c2baa0c0354bb5f9a3ecbe5ed12ab4d8e11ba873c2f11161202b945",
      "before": null,
      "path": "human_decisions"
    },
    {
      "after": "468ec1a0df3a22f3f887d83378fc3a044246693879e39056e5813806e801709d",
      "before": null,
      "path": "lifecycle"
    },
    {
      "after": "abd6a9d54c353b7685d395b4947e4f68652f97ebe3adb01ea20f74fbd9771c48",
      "before": null,
      "path": "project"
    },
    {
      "after": "6b86b273ff34fce19d6b804eff5a3f5747ada4eaa22f1d49c01e52ddb7875b4b",
      "before": null,
      "path": "revision"
    },
    {
      "after": "cc2b380e8f47141469a1c09b7f85c79cfc85252263f0c36fd1660fd28a99e64f",
      "before": null,
      "path": "run_id"
    },
    {
      "after": "a51162aeeb057ca4e3df627977231de20b581f0d0d418ca3a111bc0e408ac6cc",
      "before": null,
      "path": "schema_version"
    },
    {
      "after": "7279d7a51957b49f751c22084a6f85ee43f9151843524def509c497d115c44e5",
      "before": null,
      "path": "stages"
    },
    {
      "after": "60fbb469e938e5b76503d16f5790912560ab461189a6fa9c6a724c550428c0b3",
      "before": null,
      "path": "started_at"
    },
    {
      "after": "18b976f138a847a08ebfc2ca9b321b687940cc7306e96a29fdeaa65aa50142e2",
      "before": null,
      "path": "verification"
    }
  ],
  "event_type": "run.created",
  "manifest_sha256": "dc3661b7ca26ee65a381c2458e3c83081a90c7fc4badcd8064e8a59550b35c01",
  "previous_event_sha256": null,
  "recorded_at": "2026-09-26T19:58:18Z",
  "run_id": "20260926T195818286566Z-9b54edda",
  "schema_version": "1.0",
  "sequence": 1
}
